{"schema_version":"0.4.0","phase":"R2","production_review_id":"natrinai-r2-production-383","work_id":"natrinai","record_id":"natrinai-383","source_sequence":383,"source_snapshot":{"canonical_record_path":"corpus/natrinai/poems/383.md","canonical_record_git_blob_sha":"064d3d5c91e177deaf5f602f910b4e409784574c","canonical_record_sha256":"689eeec88e1e4e56f3a30621ee750caf5c81b90636ac8638552b86bca93f1bdd","canonical_body_sha256":"2c698b14e2d7bde1b8a969cae909d6db04bc0362726449814e9f603181e9568f","textual_status":"complete","canonical_text_available":true},"source_metadata_reviewed":[{"source_field":"work","source_text":"நற்றிணை","classification_role":"source_explicit_evidence"},{"source_field":"thinai","source_text":"குறிஞ்சி","classification_role":"source_explicit_evidence"},{"source_field":"source_note_as_printed","source_text":"தோழி ஆறு பார்த்துற்றுச் சொல்லியது","classification_role":"source_explicit_evidence"},{"source_field":"poet_as_printed","source_text":"கோளியூர்கிழார் மகனார் செழியனார்","classification_role":"unresolved_mention"},{"source_field":"section","source_text":"351-400","classification_role":"mechanical_navigation_only"}],"dimensions_considered":29,"dimension_reviews":[{"ordinal":1,"dimension":"literary_domain","status":"evidence_recorded","observation_ids":["obs.prod.r2.de393080888d35f631520cfe"],"review_note":"Qualifying source evidence recorded."},{"ordinal":2,"dimension":"tinai_turai","status":"evidence_recorded","observation_ids":["obs.prod.r2.15164239225b28d53093a9d7"],"review_note":"Qualifying source evidence recorded."},{"ordinal":3,"dimension":"landscape_environment","status":"evidence_recorded","observation_ids":["obs.prod.r2.b52eea7047abdf89baf80037"],"review_note":"Qualifying source evidence recorded."},{"ordinal":4,"dimension":"season_weather_time","status":"no_qualifying_evidence_identified","observation_ids":[],"review_note":"No qualifying evidence identified."},{"ordinal":5,"dimension":"flora","status":"evidence_recorded","observation_ids":["obs.prod.r2.50bbe9a10aa4208b7c0bf7d2"],"review_note":"Qualifying source evidence recorded."},{"ordinal":6,"dimension":"fauna","status":"evidence_recorded","observation_ids":["obs.prod.r2.c11504719c09cc2bd797e610"],"review_note":"Qualifying source evidence recorded."},{"ordinal":7,"dimension":"people_social_roles","status":"evidence_recorded","observation_ids":["obs.prod.r2.740d0960b52765d2e7c62abf"],"review_note":"Qualifying source evidence recorded."},{"ordinal":8,"dimension":"relationships","status":"evidence_recorded","observation_ids":["obs.prod.r2.7a090fa2eed5c40c7d79470e"],"review_note":"Qualifying source evidence recorded."},{"ordinal":9,"dimension":"emotion_lived_experience","status":"evidence_recorded","observation_ids":["obs.prod.r2.79d1bc390f7f08216a33d0c6"],"review_note":"Qualifying source evidence recorded."},{"ordinal":10,"dimension":"occupations_production","status":"no_qualifying_evidence_identified","observation_ids":[],"review_note":"No qualifying evidence identified."},{"ordinal":11,"dimension":"food_subsistence","status":"no_qualifying_evidence_identified","observation_ids":[],"review_note":"No qualifying evidence identified."},{"ordinal":12,"dimension":"clothing_ornaments_adornment","status":"no_qualifying_evidence_identified","observation_ids":[],"review_note":"No qualifying evidence identified."},{"ordinal":13,"dimension":"material_culture_everyday_objects","status":"no_qualifying_evidence_identified","observation_ids":[],"review_note":"No qualifying evidence identified."},{"ordinal":14,"dimension":"weapons_warfare","status":"evidence_recorded","observation_ids":["obs.prod.r2.91aea278a66358baf493586a"],"review_note":"Qualifying source evidence recorded."},{"ordinal":15,"dimension":"mobility_transport","status":"no_qualifying_evidence_identified","observation_ids":[],"review_note":"No qualifying evidence identified."},{"ordinal":16,"dimension":"settlements_built_environment","status":"no_qualifying_evidence_identified","observation_ids":[],"review_note":"No qualifying evidence identified."},{"ordinal":17,"dimension":"economy","status":"no_qualifying_evidence_identified","observation_ids":[],"review_note":"No qualifying evidence identified."},{"ordinal":18,"dimension":"trade_exchange","status":"no_qualifying_evidence_identified","observation_ids":[],"review_note":"No qualifying evidence identified."},{"ordinal":19,"dimension":"polity_political_life","status":"no_qualifying_evidence_identified","observation_ids":[],"review_note":"No qualifying evidence identified."},{"ordinal":20,"dimension":"communities_social_groups","status":"no_qualifying_evidence_identified","observation_ids":[],"review_note":"No qualifying evidence identified."},{"ordinal":21,"dimension":"family_gender_kinship","status":"no_qualifying_evidence_identified","observation_ids":[],"review_note":"No qualifying evidence identified."},{"ordinal":22,"dimension":"religion_ritual","status":"no_qualifying_evidence_identified","observation_ids":[],"review_note":"No qualifying evidence identified."},{"ordinal":23,"dimension":"death_mourning_memory","status":"no_qualifying_evidence_identified","observation_ids":[],"review_note":"No qualifying evidence identified."},{"ordinal":24,"dimension":"arts_music_performance","status":"evidence_recorded","observation_ids":["obs.prod.r2.acad2449a505c87dd9ce0e9e"],"review_note":"Qualifying source evidence recorded."},{"ordinal":25,"dimension":"knowledge_technology","status":"no_qualifying_evidence_identified","observation_ids":[],"review_note":"No qualifying evidence identified."},{"ordinal":26,"dimension":"values_ethical_concepts","status":"no_qualifying_evidence_identified","observation_ids":[],"review_note":"No qualifying evidence identified."},{"ordinal":27,"dimension":"body_health","status":"evidence_recorded","observation_ids":["obs.prod.r2.3d12f06950609ba1553299f7"],"review_note":"Qualifying source evidence recorded."},{"ordinal":28,"dimension":"named_entities","status":"evidence_recorded","observation_ids":["obs.prod.r2.b7732d471cd915cbc2f189d0"],"review_note":"Qualifying source evidence recorded."},{"ordinal":29,"dimension":"textual_intertextual_relationships","status":"no_qualifying_evidence_identified","observation_ids":[],"review_note":"No qualifying evidence identified."}],"observations":[{"observation_id":"obs.prod.r2.de393080888d35f631520cfe","dimension":"literary_domain","concept_id":"literary.domain.akam","evidence_class":"SOURCE_EXPLICIT","classification_basis":"work_level_classification","evidence_refs":[{"source_field":"work","source_location":"yaml:work","evidence_span":null,"source_text":"நற்றிணை"}],"confidence":"high","review_status":"reviewed","reviewer_type":"assistant_assisted","historical_identity_status":"not_applicable","note":"Naṟṟiṇai is treated as Akam work context; this is not inferred from the body."},{"observation_id":"obs.prod.r2.15164239225b28d53093a9d7","dimension":"tinai_turai","concept_id":"literary.tinai.kurinji","evidence_class":"SOURCE_EXPLICIT","classification_basis":"source_metadata_explicit","evidence_refs":[{"source_field":"thinai","source_location":"yaml:thinai","evidence_span":null,"source_text":"குறிஞ்சி"}],"confidence":"high","review_status":"reviewed","reviewer_type":"assistant_assisted","historical_identity_status":"not_applicable","note":"Exact printed tiṇai field retained, including uncertainty or attached source wording."},{"observation_id":"obs.prod.r2.740d0960b52765d2e7c62abf","dimension":"people_social_roles","concept_id":null,"evidence_class":"SOURCE_EXPLICIT","classification_basis":"source_metadata_explicit","evidence_refs":[{"source_field":"source_note_as_printed","source_location":"markdown:source-note","evidence_span":{"start_line":1,"start_character":0,"end_line":1,"end_character":33},"source_text":"தோழி ஆறு பார்த்துற்றுச் சொல்லியது"}],"confidence":"high","review_status":"reviewed","reviewer_type":"assistant_assisted","historical_identity_status":"not_applicable","note":"Printed source note retains dramatic roles/context as provenance-distinct evidence; no scene is reconstructed beyond its wording."},{"observation_id":"obs.prod.r2.7a090fa2eed5c40c7d79470e","dimension":"relationships","concept_id":null,"evidence_class":"SOURCE_EXPLICIT","classification_basis":"source_metadata_explicit","evidence_refs":[{"source_field":"source_note_as_printed","source_location":"markdown:source-note","evidence_span":{"start_line":1,"start_character":0,"end_line":1,"end_character":33},"source_text":"தோழி ஆறு பார்த்துற்றுச் சொல்லியது"}],"confidence":"high","review_status":"reviewed","reviewer_type":"assistant_assisted","historical_identity_status":"not_applicable","note":"Printed source note retains dramatic roles/context as provenance-distinct evidence; no scene is reconstructed beyond its wording."},{"observation_id":"obs.prod.r2.b7732d471cd915cbc2f189d0","dimension":"named_entities","concept_id":null,"evidence_class":"SOURCE_EXPLICIT","classification_basis":"source_metadata_explicit","evidence_refs":[{"source_field":"poet_as_printed","source_location":"yaml:poet_as_printed","evidence_span":null,"source_text":"கோளியூர்கிழார் மகனார் செழியனார்"}],"confidence":"high","review_status":"reviewed","reviewer_type":"assistant_assisted","historical_identity_status":"unresolved","note":"Printed poet attribution retained as an unresolved mention; null and question-mark forms remain unresolved."},{"observation_id":"obs.prod.r2.b52eea7047abdf89baf80037","dimension":"landscape_environment","concept_id":null,"evidence_class":"SOURCE_EXPLICIT","classification_basis":"direct_record_review","evidence_refs":[{"source_field":"canonical_body","source_location":"markdown:canonical-body","evidence_span":{"start_line":9,"start_character":0,"end_line":9,"end_character":25},"source_text":"ஓங்கு வரை நாட நீ வருதலானே"}],"confidence":"high","review_status":"reviewed","reviewer_type":"assistant_assisted","historical_identity_status":"not_applicable","note":"Exact environmental/place-form wording retained; no conventio